{
  "ticker": "ANTI",
  "company": "Company Name",
  "status": "watch",
  "sector": "",
  "industry": "",
  "deep_dive": {
    "news_flow": "moderate",
    "technicals": "workable",
    "included_reason": "Auto-added candidate \u2014 review before promoting to core.",
    "scores": {
      "news_flow": 50,
      "technicals": 65,
      "fundamentals": 70,
      "analyst": 50.0,
      "composite": 58.8
    }
  },
  "metrics": {
    "price": null,
    "market_cap": null,
    "sales_growth_yoy": null,
    "eps_growth_yoy": null,
    "peg": null,
    "forward_pe": null,
    "gross_margin": null,
    "profit_margin": null,
    "debt_equity": null,
    "recom": null,
    "target_price": null
  },
  "technicals": {
    "rsi14": null,
    "sma20_pct": null,
    "sma50_pct": null,
    "sma200_pct": null,
    "perf_ytd": null,
    "from_52w_high_pct": null,
    "beta": null,
    "setup": ""
  },
  "news": {
    "headline_bullets": [],
    "next_catalyst": "",
    "catalyst_date": null
  },
  "tags": [
    "growth",
    "candidate",
    "auto-added"
  ],
  "finviz_url": "https://finviz.com/quote.ashx?t=ANTI",
  "deep_dive_path": "deep-dives/ANTI-auto-2026-07-24.md",
  "updated": "2026-07-24"
}
